TITLE,DESCRIPTION,FILE,YOUTUBE
คำสั่งจัดตั้งศูนย์บัญชาการป้องกันการค้ามนุษย์ด้านแรงงานและติดตามสถานการณ์แรงงาน,,download/article/article_20171020100807.pdf,
แผนปฏิบัติการศูนย์ปฏิบัติการป้องกันการค้ามนุษย์ด้านแรงงาน,,download/article/article_20171020101301.pdf,
ยุทธศาสตร์การป้องกันและแก้ไขปัญหาการค้ามนุษย์ด้านแรงงาน พ.ศ. 2559 - 2563,,download/article/article_20171024120245.pdf,
คู่มือการปฏิบัติงานของสำนักงานแรงงานจังหวัด ประจำปีงบประมาณ พ.ศ. 2561,,download/article/article_20171019095206.doc,
ตัวอย่าง แผนปฏิบัติการป้องกันการค้ามนุษย์ด้านแรงงานจังหวัด... ประจำปี 2561,,download/article/article_20171020100928.doc,
แบบรายงานตามแผนปฏิบัติการป้องกันการค้ามนุษย์ด้านแรงงาน จังหวัด... (รายเดือน),,download/article/article_20171019095516.xlsx,
แบบรายงานสรุปผลการดำเนินงานจังหวัด... ประจำปี 2561 (รายปี),,download/article/article_20171019095541.doc,
